,id,name,colors,Category,Description,price,link
60,DR2100-410,Jordan Dri-FIT x Zion,Mystic NavyStyle,Men's French Terry Pullover Hoodie,"Work hard, chill hard—the Zion way. This pullover hoodie works anywhere, so you can head from the couch to the court without changing your gear. It's made from versatile French terry and enhanced with Dri-FIT Technology to keep you cool, comfy, and fresh all day. This product is made from at least 50% sustainable materials, using a blend of both recycled polyester and organic cotton fibres. The blend is at least 10% recycled fibres or at least 10% organic cotton fibres.",₹ 3 7973 995,https://www.nike.com/in/t/jordan-dri-fit-zion-french-terry-pullover-hoodie-gwFhzx/DR2100-410
61,DM2424-330,Jordan Granville Pro SP,Ocean Cube/Off-Noir/Light Smoke Grey/Ocean CubeStyle,Men's Shoes,"What's your go-to? A fresh addition to the 23 Engineered line, the Granville Pro swoops in and delivers big on the concept of 24/7. Pairing innovation with off-court DNA, a Formula 23 midsole brings the comfort. The upper sports a throwback mix of materials inspired by MJ's university days, from classic suede to laser-cut textile and airy mesh. Exposed foam on the tongue and a sporty heel clip add retro-futuristic flair, while hidden details (check out the tongue label text and ""23"" moulded into the outsole) add clout. Whether you're chilling with friends, heading to the office or lacing up for a big night out—the Granville Pro has you covered.",12 795,https://www.nike.com/in/t/jordan-granville-pro-sp-shoes-TFVTD5/DM2424-330
62,DN1856-441,Jordan Series ES,French Blue/White/Sail/Ashen SlateStyle,Men's Shoes,"Inspired by Mike's backyard battles with his older brother Larry, the Jordan Series references their legendary sibling rivalry throughout the design. The rubber sole offers more than just impressive traction—it also tells the story of how MJ came to be #23. Look for the hidden reminder to ""Swing for the Fence"", a direct quote from Larry to his little bro.",7 495,https://www.nike.com/in/t/jordan-series-es-shoes-FDtg9v/DN1856-441
63,DN4195-430,Air Jordan XXXVI Low Luka PF,Laser Blue/Electric Purple/Pink Prime/Electric GreenStyle,Men's Basketball Shoes,"From the perimeter to the hoop, take the court with confidence. This is one of the lightest Air Jordan game shoes to date, with a minimal but durable leno-weave upper reinforced with tough plastic details. Meanwhile, Zoom Air cushioning delivers energy return and elite responsiveness. The game asks for everything—now you have the shoe to match.",16 295,https://www.nike.com/in/t/air-jordan-xxxvi-low-luka-pf-basketball-shoes-zNLHjc/DN4195-430
64,DC9836-060,Jordan Air 200E,Black/Smoke Grey/White/University RedStyle,Men's Shoes,"Designed to roam the streets with comfort and attitude in mind, the Jordan Air 200E mixes overt tech with durable materials while staying true to Jordan DNA. The low-cut silhouette pairs visual geometry with Max Air for a stylish, versatile ride.",₹ 11 39711 995,https://www.nike.com/in/t/jordan-air-200e-shoes-RJ2RrL/DC9836-060
65,440889-141,Jordan 5 Retro,White/Black/Dark ConcordStyle,Younger Kids' Shoes,"The Jordan 5 Retro gives younger kids an instant connection to Jordan heritage. Inspired by MJ's 5th game shoe, it features leather in the upper, with classic design lines and details that made the original such a hit.",6 495,https://www.nike.com/in/t/jordan-5-retro-younger-shoes-QQL87h/440889-141
66,DO2155-100,Jordan Delta 2 x CLOT,White/Iron Grey/Navy/Multi-ColourStyle,Men's Shoes,"With a design sensibility that bridges East and West, CLOT founder Edison Chen brings his expressive style to a fresh collab. Pairing DNA from the AJ13 with a coveted colourway, he delivers an original look that remains rooted to Jordan heritage. Full of intricate detailing (check out the holographic hangtag and 2-layer mesh-foam upper), Chen effortlessly merges icons so you can step into the future of off-court style. Insole graphics and rubberised tongue logos seal the deal—this is an undeniably impeccable look.",14 495,https://www.nike.com/in/t/jordan-delta-2-clot-shoes-gVRsjW/DO2155-100
67,DX5881-168,Jordan 1 Low Alt,White/Safety Orange/PinksicleStyle,Baby/Toddler Shoes,These mini Js combine an iconic design with fresh new colours. They're soft and flexible underfoot to keep little feet comfortable all day long. The easy-peasy hook-and-loop fastener makes it a breeze to put their shoes on so you can get to the good stuff.,3 995,https://www.nike.com/in/t/jordan-1-low-alt-shoes-gDSsCW/DX5881-168
68,,Air Jordan Wordmark,,Men's Fleece Hoodie,,5 695,https://www.nike.com/in/launch/r/DV6463-645
69,DZ7313-010,Jordan Flight Essentials,BlackStyle,Men's Oversized T-Shirt,"Designed with an intentionally oversized fit, this tee is ready for whatever the day brings. With a Jumpman woven patch on the chest, no one will question what you're about.",2 495,https://www.nike.com/in/t/jordan-flight-essentials-oversized-t-shirt-C7XVkQ/DZ7313-010
70,DR3102-316,Jordan x J Balvin,Jade Aura/Enamel GreenStyle,Men's Crew,"J Balvin remixes the classic crew to help you look good and stay warm. UV-reactive embroidered logos shimmer in the sunlight, energising any outfit.",5 995,https://www.nike.com/in/t/jordan-j-balvin-crew-55MbpG/DR3102-316
71,DQ7358-610,Jordan 23 Engineered,Atmosphere/Team Orange/BlackStyle,Men's T-Shirt,"Look good, feel even better in this soft tee made from at least 75% organic cotton. It has a classic, relaxed fit and features a subtle printed graphic to elevate an everyday staple.",₹ 2 3672 495,https://www.nike.com/in/t/jordan-23-engineered-t-shirt-sNCFHz/DQ7358-610
72,DO5047-801,Jordan 1 KO,Rush Orange/Sail/WhiteStyle,Shoes,"The Jordan 1 inspires admiration among collectors and next-gen fans alike. The Jordan 1 KO repackages the famous icon using a mix of synthetic leather and canvas, with a fit that's redesigned for comfort.",12 495,https://www.nike.com/in/t/jordan-1-ko-shoes-RLJcHC/DO5047-801
73,DM3104-010,Paris Saint-Germain,Black/Bright CrimsonStyle,Men's Woven Jacket,"Stay warm while repping your favourite club in this PSG jacket. It's fully lined for warmth and comfort and it fastens with press studs for a sporty, streamlined look.",5 495,https://www.nike.com/in/t/paris-saint-germain-woven-jacket-2J62xG/DM3104-010
74,DV3072-045,Jordan Flight Heritage 85,Off-NoirStyle,Men's T-Shirt,"Pay respect to the history of Flight in a tee that bridges past and present. A vintage MJ print is paired with modern graphics on soft, premium cotton.",2 695,https://www.nike.com/in/t/jordan-flight-heritage-85-t-shirt-Z4Wgfb/DV3072-045
75,DJ6123-010,Zion,Black/BlackStyle,Bucket Hat,"Rock one of Zion's favourite styles in the Zion Bucket Hat from Jordan Brand.Made from stretchy woven fabric, it has a toggled drawcord and stitched-down loops all around above the brim.",1 995,https://www.nike.com/in/t/zion-bucket-hat-DGBZ7T/DJ6123-010
76,CZ0791-801,Jordan LS,Rust Oxide/Summit White/University Red/BlackStyle,Slides,"Fresh and functional, the Jordan LS Slide offers step-in comfort.It has an adjustable fold-over strap built on a Solarsoft foam footbed, plus a removable heel strap to personalise your fit.A removable stash pocket ups the utility.",₹ 6 4576 795,https://www.nike.com/in/t/jordan-ls-slides-v8c9t9/CZ0791-801
77,DR6085-107,Luka 1,White/Volt/BlackStyle,Baby/Toddler Shoes,"Even if baby can't sink a step-back jumper just yet, they can still have fun in comfort and style. Lightweight materials and plush foam keep little feet happy as they learn to make their first moves.",3 495,https://www.nike.com/in/t/luka-1-shoes-v8SLFq/DR6085-107
78,DR6086-107,Luka 1,White/Volt/BlackStyle,Younger Kids' Shoes,"Designed for #77 and made for little athletes. Lightweight uppers and full-length foam cushioning will keep them happy on the playground, basketball court or wherever else adventure takes them.",5 495,https://www.nike.com/in/t/luka-1-younger-shoes-MwxH4W/DR6086-107
79,DQ6513-107,Luka 1,White/Volt/BlackStyle,Older Kids' Basketball Shoes,"Designed for No. 77 and made for every athlete craving speed and efficiency, Luka's debut delivers the goods. The first shoe with full-length Formula 23 foam, it has an ultra-supportive fit crafted with the step-back in mind. Meanwhile, strong and lightweight Flight Wire embroidery keeps you feeling contained on the court. This is the assist you've been waiting for—get out there and make your shot.",6 295,https://www.nike.com/in/t/luka-1-older-basketball-shoes-klvVxs/DQ6513-107
80,DO8863-600,Jordan Sophia,Canyon Pink/Sail/Ice Blue/Fire RedStyle,Women's Slides,"Plush comfort is a must for your winter wardrobe—and footwear is no exception. These luxe slides have pillowy, criss-cross straps lined with fabric that feels soft against your skin. Air cushioning and a slight platform give you that ""walking on clouds"" feel with every step.",7 495,https://www.nike.com/in/t/jordan-sophia-slides-dcq32F/DO8863-600
81,DQ7334-405,Jordan Dri-FIT Sport BC,Hyper Royal/Hyper Royal/WhiteStyle,Men's Diamond Shorts,"Go for the gold in shorts inspired by one of MJ's most legendary looks. A hand-drawn design riffs on the head-to-toe AJ7 print he wore in Barcelona during the 1992 Summer Games. They're built with sweat-wicking Dri-FIT Technology and breathable mesh that's 100% recycled, so you can take on the world in comfort.",2 795,https://www.nike.com/in/t/jordan-dri-fit-sport-bc-diamond-shorts-T8lNXx/DQ7334-405
82,AR2118-688,Jordan Pro Jumpman,Gym Red/Black/Black/Dark Smoke GreyStyle,Snapback Hat,"Show them your hops in the Jordan Pro Jumpman Snapback Hat. It has a flat bill and high structured crown made from tightly woven twill. The iconic logo is thickly embroidered on the front, a bold projection of the Brand's heritage. This product is made from at least 50% recycled polyester fibres.",1 595,https://www.nike.com/in/t/jordan-pro-jumpman-snapback-hat-KbPBND/AR2118-688
83,DQ7693-419,Jordan 2 Retro J Balvin,Celestine Blue/Multi-Colour/WhiteStyle,Younger Kids' Shoes,"Like a breath of fresh air, these kicks deliver plenty of energetic details and J Balvin's sky's-the-limit style. Puffed-up panels on the upper and cloud graphics around the heel, collar and insole are combined with rainbow stitching and the Prince of Reggaeton's signature smiley face to steal the hearts of passers-by.",7 495,https://www.nike.com/in/t/jordan-2-retro-j-balvin-younger-shoes-1PkW65/DQ7693-419
84,DN2647-160,Jordan Delta 3 Low,White/Black/Chile RedStyle,Men's Shoes,"You can't help but look cool in low tops that meld high-end craft with high-tech features. Airy Ripstop and soft, synthetic suede pair with a smooth interior. The result? Classic low-top looks and the premium comfort you expect from Jordan Brand.",12 795,https://www.nike.com/in/t/jordan-delta-3-low-shoes-fQrm6Q/DN2647-160
85,CI3436-063,Jordan 1 Low Alt,Black/White/Fire RedStyle,Baby & Toddler Shoes,The Jordan 1 Low Alt keeps little feet comfortable with flexible bands that feel snug and soft foam cushioning underfoot.Leather and synthetic leather have a classic look and feel.,3 495,https://www.nike.com/in/t/jordan-1-low-alt-shoes-RCQGFn/CI3436-063
86,DQ3735-003,Jordan 5 Retro,Silver/Flint Grey/Green BeanStyle,Younger Kids' Shoes,"Even little feet need big style, and the Jordan 5 delivers. With a classic look based on the AJ5, it's made from sturdy materials for support during play. Plenty of padding keeps 'em comfy, and a rubber sole provides traction all over the playground.",₹ 6 1676 495,https://www.nike.com/in/t/jordan-5-retro-younger-shoes-pwzC08/DQ3735-003
87,DQ6829-100,Jordan x Zion,WhiteStyle,Men's T-Shirt,"Believe it! Zion is an anime super-fan, and now you can rep his passion with this Jordan x Zion tee. Flex his favourite show on soft and lightweight cotton, equally perfect for workouts or hangouts.",2 195,https://www.nike.com/in/t/jordan-zion-t-shirt-gNRFJt/DQ6829-100
88,DC7485-091,Jordan Jumpman,Carbon Heather/BlackStyle,Men's Short-Sleeve T-Shirt,"Rise and shine in this classic tee from Jordan Brand. Made from soft, comfortable cotton, it features a clean, classic Jumpman that's embroidered on the chest.",1 595,https://www.nike.com/in/t/jordan-jumpman-short-sleeve-t-shirt-df6fwF/DC7485-091
89,CI7849-610,Jordan Flare,Gym Red/White/BlackStyle,Younger Kids' Shoe,"Perfect for active kids, the Jordan Flare is light, breathable and comfortable. It's easy to get on, has a heel band to keep it from slipping off and is covered in the front to help prevent toe stubs.",2 995,https://www.nike.com/in/t/jordan-flare-younger-shoe-8xqMTD/CI7849-610
90,DQ4651-612,Air Jordan,Fire Red/SailStyle,Women's Joggers,It's your life—live it in Jordan. These tracksuit bottoms are essential for lounging at home or slipping on after a game. They're available in numerous colours and with matching crewneck sweatshirts—stock up on sets for every day of the week.,₹ 4 2674 495,https://www.nike.com/in/t/air-jordan-tracksuit-bottoms-2K9vVw/DQ4651-612
91,DM3098-070,Paris Saint-Germain,Dark Smoke Grey/BlackStyle,Men's Printed Shorts,Get comfortable without losing your cool in these all-day versatile Jordan x PSG shorts. They're made from breathable mesh with zip pockets for the essentials. Print and label details highlight our ongoing collaboration with your favourite football club.,2 795,https://www.nike.com/in/t/paris-saint-germain-printed-shorts-PwfpKW/DM3098-070
92,DV7000-819,Air Jordan x Shelflife,Safety Orange/RattanStyle,Men's T-Shirt,"Jordan and South Africa's coveted sneaker shop Shelflife come together on this soft, everyday tee. It's made with an all-over wash for a perfectly faded look, and the graphic on the back pays homage to the store's original stained glass window.",2 895,https://www.nike.com/in/t/air-jordan-shelflife-t-shirt-1KNm8K/DV7000-819
93,,Jordan x Eastside Golf,,Men's Polo,,3 995,https://www.nike.com/in/launch/r/DV1892-100
94,DV1396-410,Jordan Flight,Midnight Navy/Stealth/WhiteStyle,Women's Velour Jacket,"An oversized zip-up in plush velour is all about versatility. Throw it on over your workout gear or wear it on your way from one festive party to the next. Wherever you go, you'll be looking luxe.",5 695,https://www.nike.com/in/t/jordan-flight-velour-jacket-61tBjx/DV1396-410
95,DV6467-411,Air Jordan Wordmark,Ice Blue/SailStyle,Men's Fleece Shorts,"Your favourite shorts have some new competition. Made from soft, heavyweight fleece, this pair looks classic but feels luxe. An all-over wash effect adds a perfectly faded vintage aesthetic.",3 995,https://www.nike.com/in/t/air-jordan-wordmark-fleece-shorts-2QpfNJ/DV6467-411
96,DQ4455-010,Jordan Sport,Black/Black/Black/StealthStyle,Women's Shorts,"These roomy shorts are ready to roll. A high split on the legs gives you flexibility of movement, while a thick waistband and lightweight, sweat-wicking material deliver premium comfort.",3 295,https://www.nike.com/in/t/jordan-sport-shorts-95lZcc/DQ4455-010
97,DV1274-010,Jordan Sport,Black/StealthStyle,Women's 2-in-1 Long-Sleeve Top,"Let your outfit adapt to your needs as you move through your day in this 2-in-1 top. If you're craving breathability, remove the long-sleeve portion to reveal an asymmetrical tank. The tight fit and shelf bra feel supportive, seeing you through your activities of choice.",3 695,https://www.nike.com/in/t/jordan-sport-2-in-1-long-sleeve-top-dJclVn/DV1274-010
98,DR1485-168,Air Jordan 7 Retro BBS,Sand Drift/Malt/Turf Orange/Peach CreamStyle,Women's Shoes,"Separate yourself from the competition in the AJ7 x Bephies Beauty Supply. Unapologetic, powerful and downright heat for the streets, this is founder Beth Birkett's transgressive take on a beloved hoops icon. The Huarache-inspired heel emblem nods to one of Birkett's fave sneakers, while transparent side vents bring fresh insight into cool. A mesh inner sleeve extends up over the ankle, and a toggle cinch and embroidered accents finish the look. Branding and graphics celebrate women of colour, tapping into Birkett's design ethos of honouring the individual and involving community—a new definition of off-court style.",19 295,https://www.nike.com/in/t/air-jordan-7-retro-bbs-shoes-rvKH2m/DR1485-168
99,DV6962-133,Air Jordan x Two18,SailStyle,Men's T-Shirt,"Rep your Midwest pride with this collaborative tee celebrating Detroit's Two18 sneaker boutique. The all-over wash effect gives a perfectly faded look, while subtle branding and an original screen print add a luxe level of detail.",2 895,https://www.nike.com/in/t/air-jordan-two18-t-shirt-1CcT1W/DV6962-133
100,DX6325-204,Air Jordan 5 Retro Low PSG,Pumice/Black/Plum Eclipse/Game RoyalStyle,Men's Shoes,"Jordan and Paris Saint-Germain come together again, this time with an update to the AJ5. This low-top pair looks fresh while featuring the best elements from the original, like lace toggles, rich leather and the iconic WWII Mustang fighter plane-inspired graphic. The stamped PSG logo on the heel subtly reps your favourite club.",18 395,https://www.nike.com/in/t/air-jordan-5-retro-low-psg-shoes-bpsqMw/DX6325-204
101,DV1411-215,Jordan Flight,Mineral ClayStyle,Women's Oversized T-Shirt,AJ1s are for more than just your soles. Show your love for the iconic kicks with a soft tee in an intentionally oversized fit.,2 895,https://www.nike.com/in/t/jordan-flight-oversized-t-shirt-jPmMlN/DV1411-215
102,DV1414-010,Jordan Flight Renegade,Black/Gym Red/WhiteStyle,Women's Jacket,"Sporty, edgy and easy to layer over any top, this comfy jacket is there when you need it—and easy to take off when you don't. Colour-matched press studs look sleek and make it a cinch to adjust your look. Pulling it all together, an elegant chainstitch-embroidered logo on the back keeps all eyes on you.",9 295,https://www.nike.com/in/t/jordan-flight-renegade-jacket-r4S78j/DV1414-010
103,DQ7323-091,Jordan Dri-FIT Sport,Carbon Heather/Black/BlackStyle,Men's Full-Zip Hoodie,"Zip up, head out and stay fresh in this sleek hoodie. Its full-length zip extends up to the hood, keeping wind and chill at bay. Meanwhile, sweat-wicking Dri-FIT Technology ups the versatility, making this your go-to layer for everything from workouts to hangouts.",5 495,https://www.nike.com/in/t/jordan-dri-fit-sport-hoodie-4xncvC/DQ7323-091
104,DQ4982-160,Jordan Delta 3 Low,White/Black/Chile RedStyle,Older Kids' Shoes,You can't help but look cool in low tops that meld high-end craft with high-tech features. Airy Ripstop and soft suede are paired with a seamless interior. The result? Classic low-top looks and the premium comfort you expect from Jordan Brand.,7 495,https://www.nike.com/in/t/jordan-delta-3-low-older-shoes-8vdBb2/DQ4982-160
105,DH9075-010,Jordan Sport Dri-FIT,Black/Black/White/WhiteStyle,Men's Diamond Shorts,"Bring street style and Jordan heritage to the court. These lightweight shorts are made from breathable mesh in a classic, relaxed silhouette. With sweat-wicking Dri-FIT Technology and the iconic Diamond design, they'll keep you looking and feeling fresh all day.",2 395,https://www.nike.com/in/t/jordan-sport-dri-fit-diamond-shorts-XF3JZ5/DH9075-010
106,DJ0242-241,Jordan Jumpman,Desert BronzeStyle,Men's Jacket,"All-day utility is built right into the Jordan Jumpman Jacket. Providing versatile, lightweight coverage, it's made from water-repellent woven fabric with multiple pockets for hauling the essentials. Overlaid mesh and reflective tape bring in different textures to mix up the look and feel.",₹ 8 5478 995,https://www.nike.com/in/t/jordan-jumpman-jacket-Wz6mwH/DJ0242-241
107,DO6595-010,Jordan x Zion,BlackStyle,Men's Full-Zip Top,"The Jordan x Zion Top is inspired by Zion's passion for watching anime, combining the utility and look of streetwear with performance materials, for a look you can either play or kick back in. A reflective-design logo lines the sleeve, while the back graphic nods to his go-to show. This product is made from at least 50% recycled polyester fibres.",6 495,https://www.nike.com/in/t/jordan-zion-top-8D8nPd/DO6595-010
108,FB2931-288,Air Jordan 1 Zoom Air Comfort 'Día de Muertos',Rattan/Kumquat/Lemon Wash/StarfishStyle,Men's Shoes,"Join the celebration in the AJ1 Zoom Comfort. This edition is inspired by the traditional candles placed at ofrendas during the Día de los Muertos, helping to guide the souls of the deceased back home. The festive design includes premium suede, a vibrant Mexican marigold graphic and a richly textured, cross-hatched pattern on the collar. In our memories, in our hearts, for a lifetime and beyond … Somos Familia.",15 995,https://www.nike.com/in/t/air-jordan-1-zoom-air-comfort-dia-de-muertos-shoes-Ct5Nhc/FB2931-288
109,DQ4451-010,Jordan Sport Tunnel,Black/Black/StealthStyle,Women's Trousers,Stand out while getting things done in trousers that move with you. They're made from a substantial 2-way stretch material that flexes without losing its shape. Cargo-style pockets deliver on utility while ankle zips add a dose of hoops heritage (and let you show off your favourite kicks).,5 695,https://www.nike.com/in/t/jordan-sport-tunnel-trousers-t360pC/DQ4451-010
110,DQ0558-160,Air Jordan 2 Retro SE,White/Gym Red/Sail/Gym RedStyle,Women's Shoes,"Air Jordan 2 made its debut in 1987 as a sleeker, more streamlined version of its predecessor. This version of the AJ 2 features premium leather and an Air-Sole unit, making it the ultimate combination of performance and style.",21 695,https://www.nike.com/in/t/air-jordan-2-retro-se-shoes-qq6mFg/DQ0558-160
111,DQ7354-010,Jordan Essentials,Black/WhiteStyle,Men's Woven Shorts,"Gear up, Jumpman style. These relaxed shorts are lightweight, durable and comfortable—throw 'em on and focus on your game.",2 495,https://www.nike.com/in/t/jordan-essentials-woven-shorts-dkWZFk/DQ7354-010
112,DV1258-385,Jordan 23 Engineered,Light OliveStyle,Women's Fleece Trousers,Add warmth and edge to your look with these high-waisted fleece trousers with futuristic textured panels. Want to mix it up? Unzip the sides to reveal extra material in a matching pattern.,6 995,https://www.nike.com/in/t/jordan-23-engineered-fleece-trousers-SGzWQc/DV1258-385
113,DJ7682-078,Paris Saint-Germain 2022/23 Stadium Away,Light Smoke Grey/Black/BlackStyle,Men's Nike Dri-FIT Football Shirt,"Like other shirts from our Stadium collection, this one pairs replica design details with sweat-wicking fabric to give you a game-ready look inspired by your favourite team. This product is made from 100% recycled polyester fibres.",4 695,https://www.nike.com/in/t/paris-saint-germain-2022-23-stadium-away-dri-fit-football-shirt-F9BhXm/DJ7682-078
114,DR0501-200,Air Jordan 1 Mid SE,Beach/Sail/Cherrywood RedStyle,Women's Shoes,"With these mid-top AJ-1s, you don't have to choose a favourite colour. Contrasting panels make these sneaks stand out, proving that every side is your good side. Durable leather up top and Air cushioning underfoot make 'em perfect for all-day wear—so lace up, and let the complements roll in.",11 895,https://www.nike.com/in/t/air-jordan-1-mid-se-shoes-SXFQqx/DR0501-200
115,DV3148-011,Jordan Flight Essentials Classic99,Black/University Red/BlackStyle,Cap,"Keep your game and style in check. Complete your 'fit and rep Jordan Brand with this versatile, classic cap.",1 995,https://www.nike.com/in/t/jordan-flight-essentials-classic99-cap-MnbW21/DV3148-011
116,DH8920-687,Jordan Dri-FIT Sport,Gym Red/BlackStyle,Men's T-Shirt,This sweat-wicking tee flexes from the court to the street. It's made with a relaxed fit that you can move in plus Dri-FIT Technology to keep you fresh.,1 995,https://www.nike.com/in/t/jordan-dri-fit-sport-t-shirt-n3lwwm/DH8920-687
117,DQ7368-322,Jordan Essentials,New EmeraldStyle,Men's Printed T-Shirt,"Bring the energy in this vivid tee. The jagged-edge all-over print gives a visual upgrade to lightweight, premium cotton in a relaxed fit.",2 195,https://www.nike.com/in/t/jordan-essentials-printed-t-shirt-pTcRk2/DQ7368-322
118,DN1635-001,Air Jordan 1 Low SE Craft,Black/Light Graphite/Sail/Cement GreyStyle,Men's Shoes,"Consistently fresh and always on point, the low-profile AJ1 is one of the most iconic sneakers of all time. This version incorporates natural tones and suede details—it's a grounding refresh for a soaring legend.",9 695,https://www.nike.com/in/t/air-jordan-1-low-se-craft-shoes-q1ktlR/DN1635-001
119,DQ7320-010,Jordan Dri-FIT Sport Air,Black/Black/Dark Smoke GreyStyle,Men's Statement Trousers,"Fly for hanging, fly for hooping. These trousers have a relaxed fit that tapers at the ankle, perfect for showing off your kicks. Double-knit fabric feels smooth against your skin while sweat-wicking Dri-FIT Technology ups the versatility. Make this your go-to pair for everything from workouts to hangouts.",4 495,https://www.nike.com/in/t/jordan-dri-fit-sport-air-statement-trousers-MkT23N/DQ7320-010
120,CD7069-116,Air Jordan Legacy 312 Low,White/Gym Red/BlackStyle,Men's Shoes,The Air Jordan Legacy 312 Low celebrates Michael Jordan's legacy with this shout-out to Chicago's 312 area code. The design creates a modern mash-up of iconic Jordan elements.,12 995,https://www.nike.com/in/t/air-jordan-legacy-312-low-shoes-6Vd4Xl/CD7069-116
121,DO5038-234,Jordan Essentials,BeachStyle,Women's Boxy T-Shirt,"Elevate your everyday in this boxy tee from Jordan Brand. Made from comfy cotton, it features a roomy fit, subtle crop and a touch of Jordan heritage stitched to the chest. This product is made from at least 75% organic cotton fibres.",2 495,https://www.nike.com/in/t/jordan-essentials-boxy-t-shirt-sqZZ19/DO5038-234
122,DR1444-721,Jordan x Zion,Lemon WashStyle,Men's Long-Sleeve T-Shirt,Zion is a super-fan of anime and now you can rep his passion on the Jordan x Zion T-Shirt. Jordan elements merge with the world of anime on heavyweight cotton that's perfect for everything from workouts to hangouts.,2 895,https://www.nike.com/in/t/jordan-zion-long-sleeve-t-shirt-BRDnfX/DR1444-721
