,id,name,colors,Category,Description,price,link
123,AT3745-161,Jordan 1,White/Black/University RedStyle,Baby Cot Bootie,"With a simple hook-and-loop side closure, the Jordan 1 Bootie provides secure support while still being easy to get on and off. A flexible sole delivers lightweight, soft comfort.",₹ 3 3173 495,https://www.nike.com/in/t/jordan-1-cot-bootie-6blXxr/AT3745-161
124,DM1430-010,Jordan Dri-FIT Sport,Black/White/WhiteStyle,Men's Graphic T-Shirt,"Made from softly knit fabric with Dri-FIT sweat-wicking technology, this tee is a wardrobe staple. Graphics nod to Michael Jordan's famed ""Breakfast Club"" workouts and shout out some of his favourite outdoor basketball courts around the globe.",2 195,https://www.nike.com/in/t/jordan-dri-fit-sport-graphic-t-shirt-VgHN8w/DM1430-010
125,DQ3734-003,Air Jordan 5 Retro,Silver/Flint Grey/Green BeanStyle,Older Kids' Shoes,"Put some spring in your step with the AJ5, wrapped in an all-over speckle print inspired by Easter eggs. It's got Air cushioning underfoot and lots of iconic details from the original—peep the midfoot mesh panel, lace toggle and classic bump-out collar.",₹ 10 44710 995,https://www.nike.com/in/t/air-jordan-5-retro-older-shoes-9w5fXR/DQ3734-003
126,DD9315-002,Air Jordan 1 Low G,Wolf Grey/Photon Dust/White/BlackStyle,Golf Shoes,"Feel unbeatable, from the tee box to the final putt. Inspired by one of the most iconic sneakers of all time, the Air Jordan 1 G is an instant classic on the course. With Air cushioning underfoot, a Wings logo on the heel and an integrated traction pattern to help you power through your swing, it delivers all the clubhouse cool of the original AJ1—plus everything you need to play 18 holes in comfort.",12 995,https://www.nike.com/in/t/air-jordan-1-low-g-golf-shoes-8bKbqs/DD9315-002
127,BQ7196-016,Sky Jordan 1,Black/Varsity Red/White/AnthraciteStyle,Baby and Toddler Shoe,"Inspired by the AJ1, the Sky Jordan 1 is equal parts iconic and adorable. It has soft foam cushioning, durable traction and a hook-and-loop strap for easy on and off.",3 495,https://www.nike.com/in/t/sky-jordan-1-and-shoe-td3n17/BQ7196-016
128,DR6961-100,Jordan 1 Mid Alt SE,White/Black/Pearl White/Gym RedStyle,Baby/Toddler Shoes,"Inspired by the piles of toys and fabrics in a messy room, these kid-special shoes bring together lots of textures and colours in a mini Jordan package. Leather and textiles are layered for a look that pops—and don't forget the hook-and-loop closure system that makes on-and-off a breeze.",4 495,https://www.nike.com/in/t/jordan-1-mid-alt-se-shoes-466rzq/DR6961-100
129,DN4639-107,Air Jordan 1 Low FlyEase,White/Black/TaxiStyle,Older Kids' Shoes,The Air Jordan 1 Low FlyEase combines the coveted look of Michael Jordan's first signature sneaker with a FlyEase entry system that gets you in quickly and easily. Crisp leather and signature branding deliver premium style.,6 495,https://www.nike.com/in/t/air-jordan-1-low-flyease-older-shoes-Pr8pJH/DN4639-107
130,DX9632-902,Jordan,Multi-ColourStyle,Everyday Crew Socks (3 pairs),"Your go-to, everyday, soft and reliable socks. Sweat-wicking technology keeps your feet cool and dry while a snug arch band feels supportive.",1 295,https://www.nike.com/in/t/jordan-everyday-crew-socks-l9lmDn/DX9632-902
131,DM9677-061,Jordan Air 200E,Black/Ash Green/Sail/University RedStyle,Older Kids' Shoes,"These kicks are designed for up-and-coming sneakerheads with big ideas. A bold mix of colours and materials makes a splash, while the see-through Max Air unit embraces futuristic design. Use the handy pull tabs to get your shoes on without missing a beat and zip through your day in comfort.",₹ 7 1177 495,https://www.nike.com/in/t/jordan-air-200e-older-shoes-BsnlwW/DM9677-061
132,DX9655-010,Jordan,Black/WhiteStyle,Everyday Ankle Socks (3 Pairs),These ankle socks will keep you dry and cool with sweat-wicking fabric and breathable ankle panels. They're snug around the arch to give you that extra-supportive feel.,1 295,https://www.nike.com/in/t/jordan-everyday-ankle-socks-PqW8xF/DX9655-010
133,DO5041-010,Jordan Essentials,Black/Dark Smoke Grey/Sand DriftStyle,Women's Diamond Shorts,"One of Jordan Brand's favourite silhouettes gets smooth and satiny for the summertime. Inspired by MJ's iconic pro kit, these versatile diamond shorts feature airy mesh along the hems and eye-catching diamond side panels.",3 495,https://www.nike.com/in/t/jordan-essentials-diamond-shorts-cFL9l2/DO5041-010
134,DR1484-168,Jordan 7 Retro BBS,Sand Drift/Malt/Turf Orange/Peach CreamStyle,Younger Kids' Shoes,"Your little one will make a big impression in the Jordan 7 x Bephies Beauty Supply. The Huarache-inspired heel emblem nods to one of founder Beth Birkett's fave sneakers, while a mesh inner sleeve and embroidered accents bring fresh insight into cool. With comfy padding, supportive construction and super-easy on-and-off, they serve a lot more than just cute looks.",6 995,https://www.nike.com/in/t/jordan-7-retro-bbs-younger-shoes-bhxdRg/DR1484-168
135,DO5032-379,Jordan (Her)itage,Mint Foam/Sand DriftStyle,Women's Diamond Shorts,"Bring summertime style to a classic on-court look. Inspired by MJ's pro basketball kit, these sporty shorts are made from a double layer of mesh fabric for airy breathability.",₹ 2 8472 995,https://www.nike.com/in/t/jordan-itage-diamond-shorts-PNxzN6/DO5032-379
136,DQ4465-687,Jordan Flight,Gym Red/WhiteStyle,Women's Top,"Make this versatile top the centrepiece of your cool-weather wardrobe. Made from soft knit fabric, it fits tightly and has a cropped design that hits at the waist.",₹ 2 6572 795,https://www.nike.com/in/t/jordan-flight-top-QnwbFB/DQ4465-687
137,DQ7509-206,Jordan Essentials,Rattan/WhiteStyle,Men's Woven Trousers,"Get moving in trousers that flex with you. This relaxed pair is made from lightweight, stretch-woven fabric textured with suede-like softness.",3 695,https://www.nike.com/in/t/jordan-essentials-woven-trousers-2NkzfV/DQ7509-206
138,DQ3736-003,Jordan 5 Retro,Silver/Flint Grey/Green BeanStyle,Baby/Toddler Shoes,"Inspired by Nike's classic game shoe, these kicks have the cool factor of the AJ5 while keeping the needs of little feet in mind. We used a mix of premium materials to make 'em soft, cushiony and flexible. Rubber outsoles add stable traction for all of baby's first steps.",₹ 5 2175 495,https://www.nike.com/in/t/jordan-5-retro-shoes-b0ztg9/DQ3736-003
139,DO5048-010,Jordan Essentials,BlackStyle,Women's Tank,"Summer is coming—dress accordingly. This essential tank uses a stretchy, ribbed-knit fabric that hugs your body and flexes as you move.",₹ 2 0872 195,https://www.nike.com/in/t/jordan-essentials-tank-6Rqft7/DO5048-010
140,DV6960-258,Air Jordan x Two18,Dark Driftwood/Coconut MilkStyle,Men's Hoodie,"Rep Detroit loud and proud with this Air Jordan x Two18 collaborative hoodie. Made from luxe, heavyweight fleece and with an all-over wash effect, you'll feel fresh all day, every day.",5 995,https://www.nike.com/in/t/air-jordan-two18-hoodie-kvD5DX/DV6960-258
141,DQ7388-010,Jordan Brand Sorry,BlackStyle,Men's T-Shirt,"Sorry, not sorry—Rose City, '92 just wasn't your year. This relaxed tee highlights what went down in the legendary season that led to MJ winning his first back-to-back championships. Printed graphics give a playful nod to the joys and sorrow of pro ball.",1 795,https://www.nike.com/in/t/jordan-brand-sorry-t-shirt-dlWtwL/DQ7388-010
142,FD0624-091,Rui,Sea GlassStyle,Men's T-Shirt,"Rep Rui Hachimura, the first-ever Japanese player to be picked in Round 1 of the NBA Draft. With stylised graphics printed on a classic soft tee, who's to say you wont wear this every day?",1 795,https://www.nike.com/in/t/rui-t-shirt-JRzjst/FD0624-091
143,DM8272-010,Jordan,Black/Metallic GoldStyle,Utility Beanie,"Keep the Jordan Utility Beanie on hand for quick warmth on chilly outings.It's made from soft, stretchy acrylic with a metal Jumpman ingot fixed on the cuff.",1 695,https://www.nike.com/in/t/jordan-utility-beanie-hwKh94/DM8272-010
144,BQ6066-168,Jordan 1 Low Alt,White/Safety Orange/PinksicleStyle,Younger Kids' Shoe,The Jordan 1 Low Alt keeps little feet comfortable with flexible bands that feel snug and soft foam cushioning underfoot. Leather and synthetic leather have a classic look and feel.,4 495,https://www.nike.com/in/t/jordan-1-low-alt-younger-shoe-NpXDNW/BQ6066-168
145,DM1829-100,Jordan Dri-FIT Sport,White/Black/BlackStyle,Men's Statement Shorts,Ultimate performance with a look inspired by classic Jordan activewear. These shorts are made from flexible ribbed-knit fabric with stretch-woven overlays for coverage. Sweat-wicking Dri-FIT Technology helps you stay comfortable and focused on your game.,₹ 3 5073 695,https://www.nike.com/in/t/jordan-dri-fit-sport-statement-shorts-kNbjh4/DM1829-100
146,DQ4433-612,Jordan Sport,Fire Red/Safety Orange/Lobster/LobsterStyle,Women's Mesh Tank,"Bring your edge from the court to the street with this Wings jacket inspired tank. With lightweight, breathable fabric and an easy, relaxed fit, it's built to help you move freely.",₹ 2 3672 495,https://www.nike.com/in/t/jordan-sport-mesh-tank-hspZrf/DQ4433-612
147,DV1433-612,Jordan Brand Festive,Fire RedStyle,Men's T-Shirt,"Give the gift of Jordan this season. This tee is soft, relaxed and serves festive vibes with a touch of classic check.",1 795,https://www.nike.com/in/t/jordan-brand-festive-t-shirt-x0kbHn/DV1433-612
148,DO6599-010,Jordan x Zion,BlackStyle,Men's Trousers,"One of Zion's favourite ways to spend his downtime is watching anime, and you can rep his fandom with this collab. These trousers combine the utility and style of streetwear with performance materials for a versatile 'fit that looks and feels great anywhere. This product is made from at least 50% recycled polyester fibres.",5 495,https://www.nike.com/in/t/jordan-zion-trousers-NZ92nR/DO6599-010
149,DN3687-006,Jordan Max Aura 4,Black/White/University RedStyle,Men's Shoes,The lightweight cushioning found in this next generation basketball shoe takes cues from its predecessors. Take flight on the court with timeless style and cloud-like heel support.,11 295,https://www.nike.com/in/t/jordan-max-aura-4-shoes-cKMcXJ/DN3687-006
150,DQ7370-252,Jordan 23 Engineered,Sesame/BlackStyle,Men's Long-Sleeve T-Shirt,This all-cotton tee features graphics on the front and back so you can rep from all angles. It's relaxed and easy to wear—make it your autumn weather go-to.,2 495,https://www.nike.com/in/t/jordan-23-engineered-long-sleeve-t-shirt-37ZVk8/DQ7370-252
151,DV2008-133,Jordan Artist Series by Mia Lee,Sail/French BlueStyle,Women's Fleece Trousers,"Hailing from Chicago's South Side, artist Mia Lee shows us her world through a lens rooted in nostalgia and rebellion. Her illustrations add a vibrant twist to classic tracksuit bottoms, drawing inspiration from the spaces that have shaped her life. Midweight fleece feels soft yet structured, while a subtle red gallery pin near the pocket legitimises your look.",3 995,https://www.nike.com/in/t/jordan-artist-series-by-mia-lee-fleece-trousers-Sdp0Kr/DV2008-133
152,DR2113-010,Zion,BlackStyle,Men's Shorts,"These shorts walk the line between performance and style—just like Zion. They're made from versatile French terry with Wings-inspired stitch lines that nod to brand heritage. This product is made from at least 50% sustainable materials, using a blend of both recycled polyester and organic cotton fibres. The blend is at least 10% recycled fibres or at least 10% organic cotton fibres.",₹ 3 3173 495,https://www.nike.com/in/t/zion-shorts-1k7fQS/DR2113-010
153,DQ7376-010,Jordan Essentials Jumpman,Black/New Emerald/TaxiStyle,Men's T-Shirt,"Visualise the art of Flight in this Jumpman tee. It's made from soft cotton with an easy, relaxed fit.",1 795,https://www.nike.com/in/t/jordan-essentials-jumpman-t-shirt-jFjKvg/DQ7376-010
154,DJ0401-100,Paris Saint-Germain,WhiteStyle,Men's Logo T-Shirt,"Icons unite in the Jordan x Paris Saint-Germain collab tee. It's made from structured heavyweight cotton with dropped shoulders and an easy, relaxed fit.",2 195,https://www.nike.com/in/t/paris-saint-germain-logo-t-shirt-S2qLSV/DJ0401-100
155,DN3205-063,Jordan Series,Anthracite/White/Sail/University RedStyle,Older Kids' Shoes,"Inspired by Mike's backyard battles with his older brother Larry, the Jordan Series references their legendary sibling rivalry throughout the design. The rubber sole offers more than just impressive traction—it also tells the story of how MJ came to be #23. Look for the hidden reminder to ""Swing for the Fence"", a direct quote from Larry to his little bro.",5 995,https://www.nike.com/in/t/jordan-series-older-shoes-Bx2cJb/DN3205-063
156,DV1574-010,Jordan Essential Festive,Black/RattanStyle,Men's Fleece Crew,"Who's ready for the holidays? You are, in this cosy sweatshirt. Made from plush French terry fleece with classic checked detailing, it serves nostalgic seasonal style and plenty of Jordan heritage.",3 695,https://www.nike.com/in/t/jordan-essential-holiday-fleece-crew-jzlg36/DV1574-010
157,DQ4611-010,Jordan Flight,BlackStyle,Women's Fleece Shorts,"Casual versatility meets Jordan heritage in these mid-rise shorts. They're made from heavyweight brushed fleece and a roomy fit, perfect for working out or chilling out.",3 795,https://www.nike.com/in/t/jordan-flight-fleece-shorts-G7DjFf/DQ4611-010
158,DO5017-010,Jordan (Her)itage,Black/Gym RedStyle,Women's Shorts,"These light and summery shorts from Jordan Brand are ready to flow with your favourite warm-weather looks. Relaxed and sensibly made from 75% recycled polyester yarns, they feature woven-in pinstripes inspired by a classic MJ kit. Look close and you'll see ""AIR JORDAN"" written in the lines.",₹ 3 3173 495,https://www.nike.com/in/t/jordan-itage-shorts-fgWxlc/DO5017-010
159,DM3182-100,Jordan Air,White/Black/BlackStyle,Men's T-Shirt,"This all-cotton Jordan tee features a minimal, embroidered graphic across the chest. A relaxed fit and monochromatic look make it an easy choice.",1 795,https://www.nike.com/in/t/jordan-air-t-shirt-ZJdRQq/DM3182-100
160,DR2962-010,Jordan x J Balvin,BlackStyle,Men's T-Shirt,"Bold, bright and full of light",2 695,https://www.nike.com/in/t/jordan-j-balvin-t-shirt-hsP9l0/DR2962-010
161,DZ0604-514,Jordan Flight Essentials,Dark ConcordStyle,Men's Oversized T-Shirt,"Big 'n' baggy for comfort and style. This super-soft tee features longer sleeves and dropped shoulders. Combined with a minimal Jumpman woven chest patch, you're lookin' n-i-c-e.",2 495,https://www.nike.com/in/t/jordan-flight-essentials-oversized-t-shirt-84459x/DZ0604-514
162,DV3150-010,Jordan 23 Engineered Classic99,Black/Black/WhiteStyle,Cap,Looking to restock your stylish basics? Slip on this classic cap to rep your favourite brand and legacy.,1 695,https://www.nike.com/in/t/jordan-23-engineered-classic99-cap-CwHZnP/DV3150-010
163,DQ4394-010,Jordan Sport Essentials,Black/StealthStyle,Women's Tank,"With a cropped length, roomy fit and thoughtful details, this tank top is about to become your favourite wardrobe staple. Designed with MJ's workout cut-offs in mind, rolled hems accentuate the oversized arm holes and give the look some edge. Splits at both sides give you extra room to move and breathe, and sweat-wicking fabric keeps you dry.",1 995,https://www.nike.com/in/t/jordan-sport-essentials-tank-3DsTQs/DQ4394-010
164,DQ8066-385,Jordan 23 Engineered,Light OliveStyle,Men's Woven Trousers,"Take your look to the next level with trousers from 23 Engineered. Made from lightweight, water-repellent material, they feature zip pockets and a belted waist for on-the-go functionality. It's not all about utility, though—a subtle grid pattern adds visual interest and the slightly cropped hem lets you show off your favourite kicks.",4 095,https://www.nike.com/in/t/jordan-23-engineered-woven-trousers-c2K82D/DQ8066-385
165,DQ4649-322,Air Jordan,New Emerald/SailStyle,Women's Crew Sweatshirt,"Excellence. Attitude. Soul. Pull on ultra-soft comfort that reps Air in effortless style with this crewneck sweatshirt. French terry feels cosy, while the minimalist logo and structured cuffs and collar turn a classic staple into a surprisingly versatile layer.",₹ 5 2175 495,https://www.nike.com/in/t/air-jordan-crew-sweatshirt-bltvmR/DQ4649-322
166,DQ9802-010,Jordan Flight Renegade,BlackStyle,Women's Jacket,"Our take on a bomber jacket will keep you warm while lookin' fly. Made from an intentionally roomy fit, it has a satin finish for smoothness and just the right amount of insulation. Ribbing on the cuffs and waist keeps the cold out while front and back graphics let everyone in on your love for Jordan Brand.",14 995,https://www.nike.com/in/t/jordan-flight-renegade-jacket-jMxxTw/DQ9802-010
167,DN4890-600,Jordan System.23,Atmosphere/Light Graphite/BlackStyle,Men's Shoes,"Be the master of your modular style and redefine ""cool"" without saying goodbye to any of the cosy. The stretch-woven bootie hugs your foot with warmth and padding so you can rock it alone to get those indoor slipper vibes. Step into the lightweight, ventilated shell with its thick foam tread and feel what it means to be cushioned and stable. Put 'em together for a uniquely durable delight.",9 695,https://www.nike.com/in/t/jordan-system23-shoes-f2trlS/DN4890-600
168,DO6597-010,Jordan x Zion,BlackStyle,Men's Long-Sleeve T-Shirt,Zion is a super fan of anime and now you can rep his passion on the Jordan x Zion T-Shirt. Flex his favourite show on soft and heavyweight cotton that's perfect from workouts to hangouts.,2 495,https://www.nike.com/in/t/jordan-zion-long-sleeve-t-shirt-mqMhdW/DO6597-010
169,DA9054-660,Air Jordan XXXVI,Infrared 23/Black/White/Infrared 23Style,Older Kids' Basketball Shoes,"Find your fast in the Air Jordan XXXVI, the franchise's next expression of lightweight speed. Weighing in as one of the lightest Jordan game shoes to date, it has a thin, minimal upper that's reinforced with a wraparound ribbon of TPU for side-to-side stability. The responsive cushioning is designed to return your energy step for step to help elevate your game.",₹ 9 4979 995,https://www.nike.com/in/t/air-jordan-xxxvi-older-basketball-shoes-5rlrTs/DA9054-660
170,DM0967-105,Air Jordan 3 Retro,White/Dark Iris/Cement Grey/BlackStyle,Older Kids' Shoes,"Bold colours and classic details give the AJ3 a fun, throwback look. It's modelled after Mike's game shoe from the '80s, so you'll be walking in the footsteps of a legend.",10 995,https://www.nike.com/in/t/air-jordan-3-retro-older-shoes-ggSDPD/DM0967-105
171,DR1895-110,Jordan x Bephies Beauty Supply,Pale Ivory/Pale IvoryStyle,Women's Hoodie,"""For us, by us, for the community"". Bephies Beauty Supply applies this powerful credo to their fresh collab with Jordan Brand. This lightweight hoodie is made for warmth and features details that nod to the BBS ethos.",₹ 5 6975 995,https://www.nike.com/in/t/jordan-bephies-beauty-supply-hoodie-8ZmL3p/DR1895-110
172,DV6966-687,Air Jordan x Two18,Gym Red/Coconut MilkStyle,Women's Crew-Neck Sweatshirt,"Show off your Midwest love in this collab sweatshirt from Jordan Brand and Detroit's Two18. The super-soft fleece feels luxe, and an all-over wash effect gives it the look of a perfectly faded vintage find.",5 995,https://www.nike.com/in/t/air-jordan-two18-crew-neck-sweatshirt-LVDJzV/DV6966-687
173,DH7004-141,Air Jordan 1 Elevate Low,White/Sail/Midnight NavyStyle,Women's Shoes,"Rise to the occasion in style that soars. This shoe reworks an icon's original magic with a platform sole and low-cut silhouette. Air cushioning keeps you lifted, and sleek leather in contrasting colours adds visual interest.",11 895,https://www.nike.com/in/t/air-jordan-1-elevate-low-shoes-XlkVrM/DH7004-141
174,DR9498-168,Air Jordan 1 Low,White/Safety Orange/PinksicleStyle,Older Kids' Shoes,"Follow in the footsteps of greatness with these all-time classic kicks. Bubbly tones of orange and pink let your personality shine, and premium construction makes sure you feel as good as you look.",6 495,https://www.nike.com/in/t/air-jordan-1-low-older-shoes-gVm4Jn/DR9498-168
175,DV1408-645,Jordan Flight,Cherrywood RedStyle,Women's Graphic T-Shirt,Everything's coming up roses—and Air Jordans. This soft T-shirt has you covered with a relaxed fit and puff-print graphics.,2 895,https://www.nike.com/in/t/jordan-flight-graphic-t-shirt-J091bQ/DV1408-645
176,DR2964-316,Jordan x J Balvin,Jade Aura/Enamel GreenStyle,Men's Shorts,"Your favourite Jordan Brand shorts get a J Balvin remix with UV-reactive screen prints that shift colours when you step out on a sunny day. They're great for warm summer nights, too—saturated with bright colours, they'll stand out from the court to the dance floor.",5 195,https://www.nike.com/in/t/jordan-j-balvin-shorts-6c3Bdt/DR2964-316
177,440892-168,Jordan 5 Retro,White/Safety Orange/PinksicleStyle,Older Kids' Shoe,The Jordan 5 Retro combines heritage style with modern comfort. Its upper features genuine and synthetic leather for durability. Nike Air cushioning in the heel provides comfort all day long.,10 995,https://www.nike.com/in/t/jordan-5-retro-older-shoe-jnTpgX4k/440892-168
178,DQ6510-107,Luka 1 PF,White/Volt/BlackStyle,Men's Basketball Shoes,"Designed for No. 77 and made for every athlete craving speed and efficiency, Luka's debut delivers the goods. The first shoe with full-length Formula 23 foam, it has an ultra-supportive fit crafted with the step-back in mind. Meanwhile, strong and lightweight Flight Wire embroidery keeps you feeling contained, whether you're playing indoors or out. This is the assist you've been waiting for—get out there and make your shot. This version is designed wider and made for play on outdoor courts.",9 695,https://www.nike.com/in/t/luka-1-pf-basketball-shoes-XTzWkj/DQ6510-107
179,DQ7470-010,Jordan Essential,Black/WhiteStyle,Men's Fleece Shorts,"Gear up in everyday comfort. Made from soft fleece in a relaxed fit, these shorts feature an embroidered Jumpman logo that elevates a heritage style.",2 595,https://www.nike.com/in/t/jordan-essential-fleece-shorts-hTSdnc/DQ7470-010
180,DV1252-385,Jordan 23 Engineered,Light OliveStyle,Women's Pullover Hoodie,"This dressed-up hoodie gives you the soft cosiness of your favourite sweatshirt in an elevated design. Luxe details like a zip front pocket and stretchy, textured panels set this piece apart from its sweatshirt counterparts.",7 995,https://www.nike.com/in/t/jordan-23-engineered-pullover-hoodie-rgv5Bv/DV1252-385
181,DM1444-010,Jordan Flight Heritage '85,BlackStyle,Men's T-Shirt,"Take flight in this new graphic tee featuring custom artwork from Joe Perez. Made from structured cotton with a relaxed fit, it's made to wear all day long.",2 695,https://www.nike.com/in/t/jordan-flight-heritage-85-t-shirt-tmrT4w/DM1444-010
182,DM1831-100,Jordan Dri-FIT Sport,White/White/BlackStyle,Men's Top,"Score points on and off the court in this statement-making tee. With slight layering on the sleeves and a contrasting mesh tank, it serves a 3-in-1 look inspired by classic Jordan activewear. Meanwhile, the boxy fit and sweat-wicking Dri-FIT Technology make sure that you feel as good as you look.",₹ 3 6973 895,https://www.nike.com/in/t/jordan-dri-fit-sport-shirt-qc22Sl/DM1831-100
183,DR1893-680,Jordan x Bephies Beauty Supply,Light Wild Mango/Pale IvoryStyle,Women's Scrunchie T-Shirt,"""For us, by us, for the community"". Bephies Beauty Supply applies this powerful ethos to their fresh collab with Jordan Brand. This tee is an instant favourite—it has a body-hugging fit and soft fabric, plus unexpected details that make it stand out from your everyday basics.",4 995,https://www.nike.com/in/t/jordan-bephies-beauty-supply-scrunchie-t-shirt-QDwsBh/DR1893-680
184,553558-063,Air Jordan 1 Low,Black/White/Fire RedStyle,Men's Shoes,"Inspired by the original that debuted in 1985, the Air Jordan 1 Low offers a clean, classic look that's familiar yet always fresh. With an iconic design that pairs perfectly with any 'fit, these kicks ensure you'll always be on point.",8 995,https://www.nike.com/in/t/air-jordan-1-low-shoes-6Q1tFM/553558-063
185,DM3384-160,Jordan Delta 3 Low,White/Black/Wolf Grey/Chile RedStyle,Women's Shoes,You can't help but look cool in low tops that meld high-end craft with high-tech features. Airy Ripstop and soft suede are paired with a seamless interior. The result? Classic low-top looks and the premium comfort you expect from Jordan Brand.,12 795,https://www.nike.com/in/t/jordan-delta-3-low-shoes-DQT4DB/DM3384-160
186,DQ4607-645,Jordan Flight,Cherrywood RedStyle,Women's Fleece Trousers,"Bring sporty mobility and comfort to your everyday ensemble. These roomy tracksuit bottoms are made from heavyweight, brushed fleece with stretchy cuffs and a drawstring waist. A woven Jumpman label adds a subtle touch of brand heritage",4 295,https://www.nike.com/in/t/jordan-flight-fleece-trousers-jhWMC1/DQ4607-645
187,DM3106-010,Paris Saint-Germain,Black/Plum EclipseStyle,Men's Woven Pants,"Rep your favourite club in crisp, lightweight comfort. These woven pants are water-repellent, relaxed and threaded through with Jordan DNA and premier Paris identity.",4 295,https://www.nike.com/in/t/paris-saint-germain-woven-pants-CDNrgB/DM3106-010
188,DN3333-291,Paris Saint-Germain,Plum EclipseStyle,Women's Boxy Graphic T-Shirt,"Sport and street align in this boxy tee that reps Paris Saint-Germain. Printed graphics on soft, roomy cotton celebrate the powerhouse football club's continued partnership with Jordan Brand.",₹ 2 0872 195,https://www.nike.com/in/t/paris-saint-germain-boxy-graphic-t-shirt-GNCH99/DN3333-291
189,DM0966-160,Jordan 3 Retro,White/Black/Cement Grey/Fire RedStyle,Younger Kids' Shoes,"Bold colours and classic details give the Jordan 3 its fun, throwback look. It's modelled after Mike's legendary game shoe from the '80s, so your little one can match you and the big kids step for step.",6 495,https://www.nike.com/in/t/jordan-3-retro-younger-shoes-w66D0b/DM0966-160
