,id,name,colors,Category,Description,price,link
190,DH9077-687,Jordan Sport Dri-FIT,Gym Red/Black/BlackStyle,Men's Mesh Shorts,"The Jordan Sport Dri-FIT Shorts strike a balance between performance and street style. Made from sweat-wicking fabric, they're light, loose and breathable to help you stay cool and comfortable.",1 795,https://www.nike.com/in/t/jordan-sport-dri-fit-mesh-shorts-DT6bNk/DH9077-687
191,DQ8404-100,Jordan Max Aura 4,White/Black/University BlueStyle,Older Kids' Shoes,"This next-generation hoops-inspired shoe takes cues from its predecessors. Classic details show up in the moulded branding on the sole, embroidered graphics on the tongue and visible Air in the heel. Bold rubber tread and cloud-like cushioning will keep you light on your feet. So, what are you waiting for? Get out there and take flight.",6 995,https://www.nike.com/in/t/jordan-max-aura-4-older-shoes-LQTLF3/DQ8404-100
192,DZ7737-600,Jordan Series .05 SE Low,Canyon Pink/Sail/White/University RedStyle,Women's Shoes,Stunt the whole way from point A to point B in low-tops inspired by MJ's origins. Shiny velvet overlays and zigzag stitching will keep eyes on you as you criss-cross all over town. Thick and lustrous laces ensure that you'll stand out in the crowd—so get ready for the compliments to roll in.,8 495,https://www.nike.com/in/t/jordan-series-5-se-low-shoes-LqtnBB/DZ7737-600
193,AR1000-104,Jordan Courtside 23,White/Black/Dark ConcordStyle,Men's Shoe,The Jordan Courtside 23 Men's Shoe breaks out of the vault and onto the streets with a premium look and comfortable feel inspired by the 30th anniversary of the iconic Air Jordan 3.,11 895,https://www.nike.com/in/t/jordan-courtside-23-shoe-VvkvMK/AR1000-104
194,DN6148-291,Paris Saint-Germain,Plum Eclipse/BlackStyle,Men's Diamond Shorts,"Flex your PSG fandom and rep Jordan heritage with shorts inspired by an iconic design. They're made from stretchy fabric that's easy to move in, with framed-in mesh panels that nod to MJ's pro kit.",3 995,https://www.nike.com/in/t/paris-saint-germain-diamond-shorts-FNBkzN/DN6148-291
195,DX6582-657,Jordan Dri-FIT Zion,University RedStyle,Men's Tank Top,"You're ready to ball in this Zion-approved tank. Breathable mesh in a loose, airy fit gets an assist from sweat-wicking Dri-FIT Technology to keep you feeling fresh on and off the court.",₹ 3 3173 495,https://www.nike.com/in/t/jordan-dri-fit-zion-tank-top-1NFFDr/DX6582-657
196,DV0550-030,Zion 2 PF,Black/Black/Photon Dust/Light MentaStyle,Men's Basketball Shoes,"Channel new levels of speed and power in shoes designed for Zion and built for ballers at any level. An adjustable strap up top helps lock your foot in place while a firm midsole supports high-paced play. Plus, a wider outsole provides extra stability—perfect for playing on outdoor courts.",11 895,https://www.nike.com/in/t/zion-2-pf-basketball-shoes-FmrdSr/DV0550-030
197,DH0832-660,Air Jordan XXXVI Low PF,Infrared 23/Black/White/Infrared 23Style,Men's Basketball Shoes,"From the perimeter to the hoop, take the court with confidence. This is one of the lightest Air Jordan game shoes to date, with a minimal but durable leno-weave upper reinforced with tough plastic details. Meanwhile, Zoom Air cushioning delivers energy return and elite responsiveness. The game asks for everything—now you have the shoe to match.",16 295,https://www.nike.com/in/t/air-jordan-xxxvi-low-pf-basketball-shoes-WWGCpF/DH0832-660
198,DN3658-226,Jordan x Maison Château Rouge,Cinnamon/SailStyle,Men's Woven Trousers,"From Chicago to Paris and everywhere in between, these trousers let you rep the Jordan x MCR collab in crisp comfort. They feature an all-over print that tells a global story of youth connected through basketball culture. Front zips near the leg openings let you personalise the fit, rocking your bold look however feels best.",7 495,https://www.nike.com/in/t/jordan-maison-chateau-rouge-woven-trousers-DwRt6t/DN3658-226
199,DV7020-010,Air Jordan x Shelflife,Black/Total OrangeStyle,Women's Trousers,"Super soft, super fly—these collab joggers will make you feel superhuman. Made from heavyweight fleece in an all-over wash, they feature branding that nods to both Jordan and Shelflife, South Africa's go-to spot for premium kicks.",5 695,https://www.nike.com/in/t/air-jordan-shelflife-trousers-6Xrjqh/DV7020-010
200,DO9530-504,Los Angeles Lakers Statement Edition,Field PurpleStyle,Jordan Dri-FIT NBA Swingman Jersey,"Emulate your favourite player in this Los Angeles Lakers jersey, a fan-ready favourite with logo and design details that match what the pros wear on the court. Plus, it infuses breathable mesh with sweat-wicking technology to help keep you cool and dry whether you're burning up the court or just keeping it casual around town.",5 995,https://www.nike.com/in/t/los-angeles-lakers-statement-edition-jordan-dri-fit-nba-swingman-jersey-lhdHs0/DO9530-504
201,DV1578-333,Jordan Essential Holiday,Noble Green/RattanStyle,Men's Hoodie,"Who's ready for the festive season? You are, in this cosy hoodie. Made from brushed French terry in a classic festive checked pattern, it serves up nostalgic seasonal style and a hint of Jordan heritage.",4 295,https://www.nike.com/in/t/jordan-essential-holiday-hoodie-lPfSkv/DV1578-333
202,DV1463-385,Jordan 23 Engineered,Light Olive/BlackStyle,Men's Long-Sleeve Crew,Stay ready for the weather and look effortlessly cool. This cosy sweatshirt is made from soft cotton for warmth and comfort. Minimal graphics let the stitching—inspired by MJ's iconic Wings jacket—shine through.,2 895,https://www.nike.com/in/t/jordan-23-engineered-long-sleeve-crew-xvFtKN/DV1463-385
203,DM1412-501,Jordan Sport DNA,Plum FogStyle,Jacket,"Connect to the timeless heritage of Jordan Brand in this lightweight jacket. It has bold graphics on front and back, plus plenty of practical features like water-repellent fabric, a 1/2-length zip, and a locking drawcord hem.",₹ 5 2175 495,https://www.nike.com/in/t/jordan-sport-dna-jacket-jgxl1J/DM1412-501
204,DQ4599-645,Jordan Flight,Cherrywood RedStyle,Women's Fleece Crew,"Cosy fleece? Check. Classic details? Check. Your next wardrobe staple? Check, check, check. This oversized sweatshirt is made from heavyweight, brushed French terry fabric that feels super soft. A stitched-down Jumpman label on the chest lets you rep Jordan heritage wherever you go.",4 495,https://www.nike.com/in/t/jordan-flight-fleece-crew-4H6dV8/DQ4599-645
205,DN1771-104,Luka 1 PF,White/Neo Turquoise/Bright Crimson/Metallic SilverStyle,Men's Basketball Shoes,"Designed for No. 77 and made for every athlete craving speed and efficiency, Luka's debut delivers the goods. The first shoe with full-length Formula 23 foam, it has an ultra-supportive fit crafted with the step-back in mind. Meanwhile, strong and lightweight Flight Wire embroidery keeps you feeling contained, whether you're playing indoors or out. This is the assist you've been waiting for—get out there and make your shot. This version is designed wide and made for play on outdoor courts.",9 695,https://www.nike.com/in/t/luka-1-pf-basketball-shoes-4dv93M/DN1771-104
206,DV7014-206,Air Jordan x Shelflife,Rattan/Total OrangeStyle,Women's Crew,"Shout out South Africa's Shelflife with this collaborative crew neck. It's a super-soft pullover, featuring subtle branding and an all-over wash effect for the look of a perfectly faded vintage find.",5 995,https://www.nike.com/in/t/air-jordan-shelflife-crew-mFtjbW/DV7014-206
207,,Air Jordan Wordmark,,Women's Crew,,5 695,https://www.nike.com/in/launch/r/DV6469-645
208,DO5035-010,Jordan Essentials,Black/Dark Smoke Grey/Sand DriftStyle,Women's Jersey Tank,"Redefine essential with this breezy spin on a classic tank. Cool cotton on the front pairs with airy mesh on the back, while an asymmetrical hem adds edgy style to your summer look. This product is made from at least 50% organic cotton fibres.",₹ 3 5073 695,https://www.nike.com/in/t/jordan-essentials-jersey-tank-qtG0XZ/DO5035-010
209,DR9497-001,Air Jordan 1 Low,Black/Taxi/Dark Concord/New EmeraldStyle,Older Kids' Shoes,"These low-top AJ1s are stripped down to black and white essentials here, but they're anything but basic. The subdued hues make a perfect backdrop for colour-splashed imagery of Jordan himself, big and bright on the side. As always, you're getting quality materials like durable leather in the upper, supportive foam in the sole and that soft Air you know and love.",7 495,https://www.nike.com/in/t/air-jordan-1-low-older-shoes-kg36G7/DR9497-001
210,DR1901-013,Jordan x Bephies Beauty Supply,Dusty Sage/Seafoam/Pale IvoryStyle,Women's Tank,"""For us, by us, for the community"". Bephies Beauty Supply applies this powerful ethos to their fresh collab with Jordan Brand. This versatile tank has a body-hugging, stretchy feel with breathable fabric to keep you cool. Looking for extra coverage? We added detachable sleeves in case you want to change up your look. This product is made from at least 50% recycled polyester fibres.",5 495,https://www.nike.com/in/t/jordan-bephies-beauty-supply-tank-gxF67H/DR1901-013
211,DR1903-110,Jordan x Bephies Beauty Supply,Pale Ivory/Dusty SageStyle,Women's T-Shirt,"""For us, by us, for the community"". Bephies Beauty Supply applies this powerful ethos to their fresh collab with Jordan Brand. This tee is an instant favourite—it has a baggy fit and soft fabric that feels like it's been part of your wardrobe for years.",2 695,https://www.nike.com/in/t/jordan-bephies-beauty-supply-t-shirt-JbBWg7/DR1903-110
212,DV1601-010,Jordan Artist Series by Jacob Rochester,Black/Sail/University RedStyle,Men's Fleece Trousers,"You know you're going to be cosy in these fleece joggers, but you'll also be ahead of the style game with screen-printed graphics by artist Jacob Rochester. The relaxed fit and elastic waistband are made for comfort, while a red Artist Series pin legitimises your look.",4 295,https://www.nike.com/in/t/jordan-artist-series-by-jacob-rochester-fleece-trousers-4J5HKS/DV1601-010
213,DV7129-222,Air Jordan 2 Retro Low Two 18,Rocky Tan/British Tan/Gym Red/British TanStyle,Men's Shoes,"Spread the love. Tell the stories. Celebrate Detroit. Teaming up with sneaker boutique Two 18, this fresh take on the AJ2 sets out to prove that greatness comes from community. The crafted upper is made from richly textured suede with a crisp leather collar lining, while plastic eyelets add a tortoiseshell touch. With a design that's unquestionably born out of hometown pride, Two 18 bridges worlds to showcase fashion as a way of life—and a universal language.",18 395,https://www.nike.com/in/t/air-jordan-2-retro-low-two-18-shoes-pTzPwV/DV7129-222
214,DX9656-100,Jordan,White/BlackStyle,Everyday No-Show Socks (3 Pairs),Add some comfort to your style with these no-show socks. Sweat-wicking power and breathability help keep your feet dry and cool so you can push you through your day with full force.,1 295,https://www.nike.com/in/t/jordan-everyday-no-show-socks-cT9mkH/DX9656-100
215,DQ8033-014,Jordan Flight MVP,Light Graphite/Black/Infrared 23Style,Men's Statement Jacket,"When autumn kicks in, this jacket will be your wardrobe's MVP. Lightweight and water-repellent, it zips up to the mock neck collar for extra coverage. Its panel blocking is inspired by Jordan's iconic Wings warm-up jacket—a subtle nod to His Airness.",6 995,https://www.nike.com/in/t/jordan-flight-mvp-statement-jacket-XtXK04/DQ8033-014
216,384665-141,Air Jordan 6 Retro,White/Midnight NavyStyle,Older Kids' Shoes,The Air Jordan Retro 6 is made with a premium upper and the signature look that made it famous. Perforations offer ventilated comfort for kids on the move.,11 995,https://www.nike.com/in/t/air-jordan-6-retro-older-shoes-x3z2WR/384665-141
217,DQ7352-045,Jordan Essential,Off-Noir/Off-Noir/WhiteStyle,Men's Graphic Knit Shorts,"When MJ jumped, he soared. Take your style to the next level in relaxed shorts that feature a tonal graphic of tongue-out Mike going up for the slam. Lightweight material lets you move freely and a drawcord lets you adjust your fit.",₹ 2 6572 795,https://www.nike.com/in/t/jordan-essential-graphic-knit-shorts-9DHSMV/DQ7352-045
218,DM1683-001,Jordan Super Play,Black/University RedStyle,Men's Slides,Your feet deserve nothing but the best. These slides offer lightweight foam and plush underfoot cushioning—premium comfort you'll look forward to after your next big game.,4 195,https://www.nike.com/in/t/jordan-super-play-slides-Cfj5Q4/DM1683-001
219,DM1371-824,Jordan Essentials,Light Madder Root/Madder RootStyle,Men's Poolside Shorts,"Chill poolside in these summer-ready shorts. They're made from lightweight twill with a comfortable mesh liner, and graphics at the back hem add just the right amount of flair. This product is made from 100% recycled polyester fibres.",₹ 2 3672 495,https://www.nike.com/in/t/jordan-essentials-poolside-shorts-BV4pfq/DM1371-824
220,DV2011-133,Jordan Artist Series by Mia Lee,SailStyle,Women's T-Shirt,"Mia Lee's art pops to life on this soft tee, bringing a bright and playful take to the classic Jumpman logo. It's branded with a subtle Artist Series red pin, a nod to the art gallery practice that indicates when artwork has been sold.",2 695,https://www.nike.com/in/t/jordan-artist-series-by-mia-lee-t-shirt-8pWXV8/DV2011-133
221,DO5023-126,Jordan (Her)itage,Sand Drift/Mint FoamStyle,Women's Tank,"Represent MJ's legacy in this cropped tank from Jordan Brand. Made from knit cotton, it stands out with bold graphics inspired by his iconic pro kit.",₹ 2 6572 795,https://www.nike.com/in/t/jordan-itage-tank-kJLklJ/DO5023-126
222,DV1439-010,Jordan Artist Series by Jacob Rochester,Black/WhiteStyle,Men's T-Shirt,"Highlighting the work of artist Jacob Rochester, this tee revives a classic silhouette with nostalgic, hoops-inspired illustrations. Graphics are printed on soft, structured cotton in a relaxed fit, making your look into a masterpiece.",2 195,https://www.nike.com/in/t/jordan-artist-series-by-jacob-rochester-t-shirt-vNMMSW/DV1439-010
223,DO7192-164,Jordan One Take 4 PF,White/Lagoon Pulse/Gold/Chile RedStyle,Men's Shoes,"Get that speed you need, just like Russ. Inspired by Russell Westbrook's latest signature shoe, the outsole of the Jordan One Take 4 wraps up nearly to the midsole so you can start, stop or change direction in an instant. Meanwhile, energy-returning Zoom Air cushioning in the forefoot keeps you goin' (and goin' and goin').",8 695,https://www.nike.com/in/t/jordan-one-take-4-pf-shoes-cdsVn1/DO7192-164
224,DQ7342-712,Jordan Essentials,ChutneyStyle,Men's Utility Trousers,"Gear up in all-day versatility, utility and a touch of Jordan heritage. They're made from durable twill with distinct stitch lines that hook back to the brand's iconic Flight Suit. Multiple cargo pockets keep your essentials close at hand.",5 495,https://www.nike.com/in/t/jordan-essentials-utility-trousers-bLpstR/DQ7342-712
225,DJ7863-078,Paris Saint-Germain 2022/23 Stadium Away,Light Smoke Grey/Black/BlackStyle,Older Kids' Nike Dri-FIT Football Shirt,"Like other shirts from our Stadium collection, this one pairs replica design details with sweat-wicking fabric to give you a game-ready look inspired by your favourite team.",3 995,https://www.nike.com/in/t/paris-saint-germain-2022-23-stadium-away-older-dri-fit-football-shirt-NRw89p/DJ7863-078
226,DR2124-453,Jordan x Zion,Half BlueStyle,Men's T-Shirt,"Zion is a diamond in the rough—a rare gem destined for greatness. This structured tee reflects that shine with a high-gloss printed logo that hooks to the ""Hope Diamond"" colourway of his signature game shoe.",₹ 2 3672 495,https://www.nike.com/in/t/jordan-zion-t-shirt-8NcqVf/DR2124-453
227,DQ4390-322,Jordan Sport,New Emerald/Valerian Blue/Key Lime/Key LimeStyle,Women's Cropped Sweatshirt,"Cosy or cool? This soft hoodie features a cropped length and boxy fit so you don't have to choose. Design lines nod to the iconic Wings jacket to bring you a touch of MJ heritage, and sweat-wicking material keeps you dry whether you're in the gym or out in the city.",3 995,https://www.nike.com/in/t/jordan-sport-cropped-sweatshirt-S3lzpz/DQ4390-322
228,DQ8053-010,Jordan 23 Engineered,Black/BlackStyle,Men's Statement Woven Trousers,"Prepare to push boundaries in trousers that help you get stuff done. They're made from tough woven material and have cargo functionality, plus a bungee system to personalise the fit. And with at least 75% recycled nylon fibres, this is modern utility done right.",8 695,https://www.nike.com/in/t/jordan-23-engineered-statement-woven-trousers-GCK6TX/DQ8053-010
229,DV1387-588,Jordan Women's Paris Collective x LALA &ce,DaybreakStyle,Women's T-Shirt,"Check your expectations and redefine your style in this collab tee by Parisian musical artist, LALA &ce. Embroidered messaging on the sleeve speaks to her experience as a Black woman while symbolic graphics on the back showcase your strength. Soft, durable cotton and a slightly baggy fit up the comfort so you can get going with ease.",2 695,https://www.nike.com/in/t/jordan-paris-collective-lala-ce-t-shirt-gF1RKk/DV1387-588
230,DQ4448-010,Jordan Sport,Black/StealthStyle,Women's Logo Leggings,"Upgrade your everyday with leggings that know how to perform. Made from smooth, flexible fabric with Dri-FIT sweat-wicking tech, they hug your body and stretch with you as you move.",3 095,https://www.nike.com/in/t/jordan-sport-logo-leggings-JSl9d9/DQ4448-010
231,DR6960-400,Air Jordan 1 Low SE,French Blue/White/Gym Red/ChutneyStyle,Older Kids' Shoes,"Keep it colourful this holiday season in a playful pair of AJ1s. At first, they look like your classic Js—but do a double take and you'll see there's a lot more going on. Corduroy, brushed and ribbed suede and leather combine in a collage of textures, making these comfy kicks a standout look.",7 495,https://www.nike.com/in/t/air-jordan-1-low-se-older-shoes-TXVsDv/DR6960-400
232,,Jordan x Wordmark,,Men's T-Shirt,,2 895,https://www.nike.com/in/launch/r/DV6465-645
233,919712-102,Air Jordan 11 Retro Low IE,Light Orewood Brown/White/Cement Grey/Neutral GreyStyle,Men's Shoes,The Air Jordan 11 Retro Low IE Shoe offers a fresh take on one of the most beloved Jordan designs ever. It's built with lightweight and breathable materials. Full-length Air cushioning combines with premium details for the ultimate fusion of style and comfort.,16 995,https://www.nike.com/in/t/air-jordan-11-retro-low-ie-shoes-30kr7w/919712-102
234,DQ6866-803,Air Jordan XXXVI 'Taco Jay',Citron Pulse/Atomic Green/Cone/BlackStyle,Men's Basketball Shoes,"Prep for the game by lacing up your AJs, and win the game by channelling the heat of ""Taco Jay"". The 36th generation of Air Jordan celebrates the newest superstars to build the game, and this model is all about Jayson Tatum. Bridging tunnel style with performance tech, the design pays homage to Jay's intensity on the court—and fiery hot-sauce-and-cheese inspired colours nod to his favourite post-game food.",18 895,https://www.nike.com/in/t/air-jordan-xxxvi-taco-jay-basketball-shoes-BCJr1P/DQ6866-803
235,DC3687-010,Jordan Jumpman,Black/AnthraciteStyle,Washed Bucket Hat,Top off your outfit with a look that begs for some sunshine.The Jordan Jumpman Bucket Hat is made from lightweight woven twill that's been washed for a vintage look.,1 695,https://www.nike.com/in/t/jordan-jumpman-washed-bucket-hat-kblNWN/DC3687-010
236,SX5546-010,Jordan Everyday Max,Black/Black/BlackStyle,Unisex No-Show Socks (3 Pair),The Jordan Everyday Max No-Show Socks are made with sweat-wicking fabric and mesh panels for breathability. The heel and toe are reinforced for durability and support.,995,https://www.nike.com/in/t/jordan-everyday-max-no-show-socks-PXBN4g/SX5546-010
237,DM3381-600,Air Jordan 1 Mid SE,Crimson Bliss/Black/Sail/Rush OrangeStyle,Women's Shoes,"A must-have for any sneakerhead, these AJ1s bring the classic hoops look into summertime with bold, seasonal colours. Crisp leather ages to perfection while lightweight Air cushioning keeps your feet happy all day.",11 895,https://www.nike.com/in/t/air-jordan-1-mid-se-shoes-CVQmnL/DM3381-600
238,DV3073-133,Jordan Flight Heritage 85,SailStyle,Men's T-Shirt,"Prepare for take-off in this relaxed tee. It's soft yet structured thanks to heavyweight cotton, and the slightly dropped shoulders give you a little extra room to move. The iconic Flight logo is paired with stacked digitised graphics for a modern, globetrotting touch.",2 695,https://www.nike.com/in/t/jordan-flight-heritage-85-t-shirt-fvbbLW/DV3073-133
239,DQ7692-419,Jordan 2 Retro J Balvin,Celestine Blue/Multi-Colour/WhiteStyle,Baby/Toddler Shoes,"Like a breath of fresh air, these kicks deliver plenty of energetic details and J Balvin's sky's-the-limit style. Puffed-up panels on the upper and cloud graphics around the heel, collar and insole are combined with rainbow stitching and the Prince of Reggaeton's signature smiley face to steal the hearts of passers-by.",6 295,https://www.nike.com/in/t/jordan-2-retro-j-balvin-shoes-XGRHgN/DQ7692-419
240,DQ4593-133,Jordan Artist Series by Mia Lee,SailStyle,Women's T-Shirt,"This soft tee brings the bling to the ring. Rep your MJ pride and his 6-ring story while draped in roomy, lightweight cotton.",2 495,https://www.nike.com/in/t/jordan-artist-series-by-mia-lee-t-shirt-b74xc7/DQ4593-133
241,DV5631-084,Zion Sneaker School,Smoke GreyStyle,T-Shirt,"Show some love for Zion with this all-cotton tee. With a relaxed fit and bold graphics, it's got your back (literally).",2 195,https://www.nike.com/in/t/zion-sneaker-school-t-shirt-NXqdvf/DV5631-084
242,DV6996-016,Air Jordan x Shelflife,Enigma Stone/Total OrangeStyle,Men's Hoodie,"Jordan and South Africa's Shelflife come together to give you this heavyweight hoodie. Made from thick fleece with an all-over wash, it has minimal branding on the chest and sleeves for a premium, pared-down look.",5 995,https://www.nike.com/in/t/air-jordan-shelflife-hoodie-0kBJC0/DV6996-016
243,DM9045-100,Air Jordan 6 Retro,White/Citron Tint/Black/Dutch BlueStyle,Older Kids' Shoes,"An all-time classic returns. The AJ6 is back with a premium upper and all of the signature details that made it an icon. Perforations offer ventilated comfort, perfect for summertime fun.",₹ 10 44710 995,https://www.nike.com/in/t/air-jordan-6-retro-older-shoes-w3m8Pg/DM9045-100
244,DO5054-010,Jordan Essentials,BlackStyle,Women's Utility Trousers,"Lighten up for the summertime with these utility trousers, a Jordan Brand staple. They're comfy and relaxed with mesh panels for breathability. Cargo pockets close with flaps that have little zip pockets built into them.",₹ 4 7474 995,https://www.nike.com/in/t/jordan-essentials-utility-trousers-cVmVHg/DO5054-010
245,DV7040-819,Jordan x Titan,Safety Orange/ChlorophyllStyle,Women's Crew-Neck Sweatshirt,"Layer up and feel lovely in this sweatshirt made from heavyweight brushed fabric featuring an all-over wash for that worn-in look. Subtle branding nods to both Jordan and Titan, letting everyone know what you're about.",5 995,https://www.nike.com/in/t/jordan-titan-crew-neck-sweatshirt-qFtdj8/DV7040-819
246,DV3151-657,Jordan Classic99 Flight,University Red/University Red/Black/WhiteStyle,Cap,"Go anywhere, do anything in this adjustable hat. Made from breathable cotton, it features the classic Jumpman and Flight logos atop a pre-curved bill.",1 695,https://www.nike.com/in/t/jordan-classic99-flight-cap-gk3PDm/DV3151-657
247,DR9500-400,Jordan 1 Low Alt SE,Psychic Blue/Vivid Green/Safety Orange/SailStyle,Younger Kids' Shoes,"Inspire adventure in your little one with sneakers that match their energy. Subtle embroidery on a bright blue background paints a picture of sunny, summer days in the park. Durable materials and a thick rubber sole will keep 'em comfy while they run and play.",5 495,https://www.nike.com/in/t/jordan-1-low-alt-se-younger-shoes-lth6rm/DR9500-400
248,DR6962-100,Jordan 1 Mid Alt SE,White/Black/Pearl White/Gym RedStyle,Younger Kids' Shoes,"Inspired by the piles of toys and fabrics in a messy room, these kid-special shoes bring together lots of textures and colours in a mini Jordan package. Leather and textiles are layered for a look that pops—and don't forget the hook-and-loop closure system that makes on-and-off a breeze.",5 995,https://www.nike.com/in/t/jordan-1-mid-alt-se-younger-shoes-nQ65pt/DR6962-100
249,DH7381-146,Jordan Air 200E,Summit White/Atmosphere/Dark Marina Blue/Worn BlueStyle,Women's Shoes,"Designed to roam the streets all day with comfort and attitude in mind, the Jordan Air 200E mixes overt tech with durable materials, while staying true to Jordan DNA. The low-cut silhouette is paired with visual geometry and Max Air for a stylish, versatile ride.",₹ 11 39711 995,https://www.nike.com/in/t/jordan-air-200e-shoes-j54hgQ/DH7381-146
250,553560-063,Air Jordan 1 Low,Black/White/Fire RedStyle,Older Kids' Shoes,An iconic look that lasts. This AJ1 pairs the classic design of the original with premium materials that will keep you going all day.,6 495,https://www.nike.com/in/t/air-jordan-1-low-older-shoes-xLzJc6/553560-063
251,DQ7386-091,Jordan Brand Sorry,Carbon Heather/WhiteStyle,Men's Long-Sleeve T-Shirt,"Sorry, not sorry—Rose City, '92 just wasn't your year. This relaxed, long-sleeve tee highlights what went down in the legendary season that led to MJ winning his first back-to-back championships. Printed graphics give a playful nod to the joys and sorrow of pro ball.",2 495,https://www.nike.com/in/t/jordan-brand-sorry-long-sleeve-t-shirt-4nRH4z/DQ7386-091
252,CI7850-610,Jordan Flare,Gym Red/White/BlackStyle,Baby and Toddler Shoe,"Perfect for active kids, the Jordan Flare is light, breathable and comfortable from toe to heel. It's easy to get on, has a heel band to keep it from slipping off and is covered in the front to help prevent toe stubs.",2 995,https://www.nike.com/in/t/jordan-flare-and-shoe-xdcH5J/CI7850-610
